"Authors","Author full names","Author(s) ID","Title","Year","Source title","Volume","Issue","Art. No.","Page start","Page end","Page count","DOI","Link","Abstract","Document Type","Source"
"Liu W.; Shah N.; Ma I.; Rosenblau G.","Liu, Wenda (58771896900); Shah, Nikita (59289628500); Ma, Ili (57069823600); Rosenblau, Gabriela (55391049800)","58771896900; 59289628500; 57069823600; 55391049800","Strategic social decision making undergoes significant changes in typically developing and autistic early adolescents","2024","Developmental Science","27","3","e13463","","","","10.1111/desc.13463","https://www.scopus.com/inward/record.uri?eid=2-s2.0-85180177742&doi=10.1111%2fdesc.13463&partnerID=40&md5=688184a31ffd1d17d538016ad22a7119","Information sampling about others’ trustworthiness prior to cooperation allows humans to minimize the risk of exploitation. Here, we examined whether early adolescence or preadolescence, a stage defined as in between childhood and adolescence, is a significant developmental period for strategic social decisions. We also sought to characterize differences between autistic children and their typically developing (TD) peers. TD (N = 48) and autistic (N = 56) 8- to 12-year-olds played an online information sampling trust game. While both groups adapted their information sampling and cooperation to the various trustworthiness levels of the trustees, groups differed in how age and social skills modulated task behavior. In the TD group social skills were a stronger overall predictor of task behavior. In the autistic group, age was a stronger predictor and interacted with social skills. Computational modeling revealed that both groups used the same heuristic information sampling strategy—albeit older TD children were more efficient as reflected by decreasing decision noise with age. Autistic children had lower prior beliefs about the trustee's trustworthiness compared to TD children. These lower priors indicate that children believed the trustees to be less trustworthy. Lower priors scaled with lower social skills across groups. Notably, groups did not differ in prior uncertainty, meaning that the priors of TD and autistic children were equally strong. Taken together, we found significant development in information sampling and cooperation in early adolescence and nuanced differences between TD and autistic children. Our study highlights the importance of deep phenotyping of children including clinical measures, behavioral experiments and computational modeling. Research Highlights: We specified how early adolescents with and without an autism diagnosis sampled information about their interaction partners and made cooperation decisions in a strategic game. Early adolescence is a significant developmental period for strategic decision making, marked by significant changes in information sampling efficiency and adaptivity to the partner's behavior. Autistic and non-autistic groups differed in how age and social skills modulated task behavior; in non-autistic children behavior was more indicative of overall social skills. Computational modeling revealed differences between autistic and non-autistic groups in their initial beliefs about cooperation partners; autistic children expected their partners to be less trustworthy. © 2023 John Wiley & Sons Ltd.","Article","Scopus"
"Kosakowski H.L.; Norman-Haignere S.; Mynick A.; Takahashi A.; Saxe R.; Kanwisher N.","Kosakowski, Heather L. (57201394164); Norman-Haignere, Samuel (37051186800); Mynick, Anna (57191623063); Takahashi, Atsushi (58083692800); Saxe, Rebecca (6603622422); Kanwisher, Nancy (7007112379)","57201394164; 37051186800; 57191623063; 58083692800; 6603622422; 7007112379","Preliminary evidence for selective cortical responses to music in one-month-old infants","2023","Developmental Science","26","5","e13387","","","","10.1111/desc.13387","https://www.scopus.com/inward/record.uri?eid=2-s2.0-85150943962&doi=10.1111%2fdesc.13387&partnerID=40&md5=23f468b8123842b77496d20c1c395921","Prior studies have observed selective neural responses in the adult human auditory cortex to music and speech that cannot be explained by the differing lower-level acoustic properties of these stimuli. Does infant cortex exhibit similarly selective responses to music and speech shortly after birth? To answer this question, we attempted to collect functional magnetic resonance imaging (fMRI) data from 45 sleeping infants (2.0- to 11.9-weeks-old) while they listened to monophonic instrumental lullabies and infant-directed speech produced by a mother. To match acoustic variation between music and speech sounds we (1) recorded music from instruments that had a similar spectral range as female infant-directed speech, (2) used a novel excitation-matching algorithm to match the cochleagrams of music and speech stimuli, and (3) synthesized “model-matched” stimuli that were matched in spectrotemporal modulation statistics to (yet perceptually distinct from) music or speech. Of the 36 infants we collected usable data from, 19 had significant activations to sounds overall compared to scanner noise. From these infants, we observed a set of voxels in non-primary auditory cortex (NPAC) but not in Heschl's Gyrus that responded significantly more to music than to each of the other three stimulus types (but not significantly more strongly than to the background scanner noise). In contrast, our planned analyses did not reveal voxels in NPAC that responded more to speech than to model-matched speech, although other unplanned analyses did. These preliminary findings suggest that music selectivity arises within the first month of life. A video abstract of this article can be viewed at https://youtu.be/c8IGFvzxudk. Research Highlights: Responses to music, speech, and control sounds matched for the spectrotemporal modulation-statistics of each sound were measured from 2- to 11-week-old sleeping infants using fMRI. Auditory cortex was significantly activated by these stimuli in 19 out of 36 sleeping infants. Selective responses to music compared to the three other stimulus classes were found in non-primary auditory cortex but not in nearby Heschl's Gyrus. Selective responses to speech were not observed in planned analyses but were observed in unplanned, exploratory analyses. © 2023 The Authors. Developmental Science published by John Wiley & Sons Ltd.","Article","Scopus"
"Tan E.; Zeytinoglu S.; Morales S.; Buzzell G.A.; Almas A.N.; Degnan K.A.; Chronis-Tuscano A.; Henderson H.; Pine D.S.; Fox N.A.","Tan, Enda (57189386313); Zeytinoglu, Selin (57192306684); Morales, Santiago (55847605700); Buzzell, George A. (55847406400); Almas, Alisa N. (35767478900); Degnan, Kathryn A. (20336761500); Chronis-Tuscano, Andrea (24340706400); Henderson, Heather (7102809315); Pine, Daniel S. (7102750324); Fox, Nathan A. (7201444367)","57189386313; 57192306684; 55847605700; 55847406400; 35767478900; 20336761500; 24340706400; 7102809315; 7102750324; 7201444367","Social versus non-social behavioral inhibition: Differential prediction from early childhood of long-term psychosocial outcomes","2024","Developmental Science","27","1","e13427","","","","10.1111/desc.13427","https://www.scopus.com/inward/record.uri?eid=2-s2.0-85178889290&doi=10.1111%2fdesc.13427&partnerID=40&md5=388c24d0a2c1095ddbfe86a97bc9b0c3","Behavioral inhibition (BI) is a temperamental style characterized by cautious and fearful behaviors in novel situations. The present multi-method, longitudinal study examined whether young children's observed and parent-reported BI in social versus non-social contexts predicts different long-term psychosocial outcomes. Participants (N = 279) were drawn from a longitudinal study of socioemotional development. BI in social contexts (“social BI”) was measured via children's observed wariness toward unfamiliar adults and peers at 24 and 36 months and parents’ reports of children's social fear/shyness at 24, 36, and 48 months. BI in non-social contexts (“non-social BI”) was measured via children's observed fearful responses to masks and novel toys, and parents’ reports of children's distress to non-social novelty at 9 months and non-social fear at 48 months. At 15 years, anxiety was assessed via adolescent- and parent-reports, and global internalizing and externalizing problems were assessed via parent-reports. Confirmatory factor analysis showed that a two-factor model fit the BI data significantly better than a single-factor model, providing evidence for the dissociation of BI in social versus non-social contexts. Social BI was uniquely associated with adolescent social anxiety, whereas non-social BI was specifically associated with adolescent separation anxiety. Neither social BI nor non-social BI predicted global internalizing and externalizing problems, providing evidence for the specific relations between BI and anxiety problems. Together, these results suggest that young children's inhibited responses in social versus non-social situations predict different subtypes of anxiety problems in adolescence, highlighting the multifaceted nature of BI and the divergent trajectories of different anxiety problems. © 2023 The Authors. Developmental Science published by John Wiley & Sons Ltd.","Article","Scopus"
"Arenillas-Alcón S.; Ribas-Prats T.; Puertollano M.; Mondéjar-Segovia A.; Gómez-Roig M.D.; Costa-Faidella J.; Escera C.","Arenillas-Alcón, Sonia (57222550341); Ribas-Prats, Teresa (57204658860); Puertollano, Marta (57195038423); Mondéjar-Segovia, Alejandro (58044022300); Gómez-Roig, María Dolores (6508107825); Costa-Faidella, Jordi (35315522000); Escera, Carles (7004399275)","57222550341; 57204658860; 57195038423; 58044022300; 6508107825; 35315522000; 7004399275","Prenatal daily musical exposure is associated with enhanced neural representation of speech fundamental frequency: Evidence from neonatal frequency-following responses","2023","Developmental Science","26","5","e13362","","","","10.1111/desc.13362","https://www.scopus.com/inward/record.uri?eid=2-s2.0-85145703431&doi=10.1111%2fdesc.13362&partnerID=40&md5=6624fb80b41e70446fe0b0fb59c810b2","Fetal hearing experiences shape the linguistic and musical preferences of neonates. From the very first moment after birth, newborns prefer their native language, recognize their mother's voice, and show a greater responsiveness to lullabies presented during pregnancy. Yet, the neural underpinnings of this experience inducing plasticity have remained elusive. Here we recorded the frequency-following response (FFR), an auditory evoked potential elicited to periodic complex sounds, to show that prenatal music exposure is associated to enhanced neural encoding of speech stimuli periodicity, which relates to the perceptual experience of pitch. FFRs were recorded in a sample of 60 healthy neonates born at term and aged 12–72 hours. The sample was divided into two groups according to their prenatal musical exposure (29 daily musically exposed; 31 not-daily musically exposed). Prenatal exposure was assessed retrospectively by a questionnaire in which mothers reported how often they sang or listened to music through loudspeakers during the last trimester of pregnancy. The FFR was recorded to either a /da/ or an /oa/ speech-syllable stimulus. Analyses were centered on stimuli sections of identical duration (113 ms) and fundamental frequency (F0 = 113 Hz). Neural encoding of stimuli periodicity was quantified as the FFR spectral amplitude at the stimulus F0. Data revealed that newborns exposed daily to music exhibit larger spectral amplitudes at F0 as compared to not-daily musically-exposed newborns, regardless of the eliciting stimulus. Our results suggest that prenatal music exposure facilitates the tuning to human speech fundamental frequency, which may support early language processing and acquisition. Research Highlights: Frequency-following responses to speech were collected from a sample of neonates prenatally exposed to music daily and compared to neonates not-daily exposed to music. Neonates who experienced daily prenatal music exposure exhibit enhanced frequency-following responses to the periodicity of speech sounds. Prenatal music exposure is associated with a fine-tuned encoding of human speech fundamental frequency, which may facilitate early language processing and acquisition. © 2022 The Authors. Developmental Science published by John Wiley & Sons Ltd.","Article","Scopus"
"Lenc T.; Peter V.; Hooper C.; Keller P.E.; Burnham D.; Nozaradan S.","Lenc, Tomas (57200447688); Peter, Varghese (36188703400); Hooper, Caitlin (58018268500); Keller, Peter E. (58008087300); Burnham, Denis (7005177876); Nozaradan, Sylvie (16239070300)","57200447688; 36188703400; 58018268500; 58008087300; 7005177876; 16239070300","Infants show enhanced neural responses to musical meter frequencies beyond low-level features","2023","Developmental Science","26","5","e13353","","","","10.1111/desc.13353","https://www.scopus.com/inward/record.uri?eid=2-s2.0-85144055019&doi=10.1111%2fdesc.13353&partnerID=40&md5=d97f8ed93196389f7da0acf98fb6ba00","Music listening often entails spontaneous perception and body movement to a periodic pulse-like meter. There is increasing evidence that this cross-cultural ability relates to neural processes that selectively enhance metric periodicities, even when these periodicities are not prominent in the acoustic stimulus. However, whether these neural processes emerge early in development remains largely unknown. Here, we recorded the electroencephalogram (EEG) of 20 healthy 5- to 6-month-old infants, while they were exposed to two rhythms known to induce the perception of meter consistently across Western adults. One rhythm contained prominent acoustic periodicities corresponding to the meter, whereas the other rhythm did not. Infants showed significantly enhanced representations of meter periodicities in their EEG responses to both rhythms. This effect is unlikely to reflect the tracking of salient acoustic features in the stimulus, as it was observed irrespective of the prominence of meter periodicities in the audio signals. Moreover, as previously observed in adults, the neural enhancement of meter was greater when the rhythm was delivered by low-pitched sounds. Together, these findings indicate that the endogenous enhancement of metric periodicities beyond low-level acoustic features is a neural property that is already present soon after birth. These high-level neural processes could set the stage for internal representations of musical meter that are critical for human movement coordination during rhythmic musical behavior. Research Highlights: 5- to 6-month-old infants were presented with auditory rhythms that induce the perception of a periodic pulse-like meter in adults. Infants showed selective enhancement of EEG activity at meter-related frequencies irrespective of the prominence of these frequencies in the stimulus. Responses at meter-related frequencies were boosted when the rhythm was conveyed by bass sounds. High-level neural processes that transform rhythmic auditory stimuli into internal meter templates emerge early after birth. © 2022 The Authors. Developmental Science published by John Wiley & Sons Ltd.","Article","Scopus"
"Smith-Flores A.S.; Herrera-Guevara I.A.; Powell L.J.","Smith-Flores, Alexis S. (57219241438); Herrera-Guevara, Isabel A. (58363936200); Powell, Lindsey J. (11440151600)","57219241438; 58363936200; 11440151600","Infants expect friends, but not rivals, to be happy for each other when they succeed","2024","Developmental Science","27","1","e13423","","","","10.1111/desc.13423","https://www.scopus.com/inward/record.uri?eid=2-s2.0-85163100134&doi=10.1111%2fdesc.13423&partnerID=40&md5=8d89c4877268c494945ba3c763eb6bf9","A friend telling you good news earns them a smile while witnessing a rival win an award may make you wrinkle your nose. Emotions arise not just from people's own circumstances, but also from the experiences of friends and rivals. Across three moderated, online looking time studies, we asked if human infants hold expectations about others’ vicarious emotions and if they expect those emotions to be guided by social relationships. Ten- and 11-month-old infants (N = 154) expected an observer to be happy rather than sad when the observer watched a friend successfully jump over a wall; infants looked longer at the sad response compared to the happy response. In contrast, infants did not expect the observer to be happy when the friend failed, nor when a different, rival jumper succeeded; infants’ looking times to the two emotion responses in these conditions were not reliably different. These results suggest that infants are able to integrate knowledge across social contexts to guide expectations about vicarious emotional responses. Here infants connected an understanding of agents’ goals and their outcomes with knowledge of social relationships to infer an emotion response. Biased concern for friends but not adversaries is not just a descriptive feature of human relationships, but an expectation about the social world present from early in development. Further, the successful integration of these information types welcomes the possibility that infants can jointly reason about goals, emotions, and social relationships under an intuitive theory of psychology. Research Highlights: 11-month-old infants use knowledge of relationships to make inferences about others’ vicarious emotions. In Experiment 1 infants expected an observer to respond happily to a friend's success but not their failure. Experiments 2 and 3 varied the relationship between the observer and actor and found that infants’ expectation of vicarious happiness is strongest for positive relationships and absent for negative relationships. The results may reflect an intuitive psychology in which infants expect friends to adopt concern for one another's goals and to thus experience one another's successes as rewarding. © 2023 The Authors. Developmental Science published by John Wiley & Sons Ltd.","Article","Scopus"
"Wang F.; Nguyen Q.T.H.; Kaneshiro B.; Hasak L.; Wang A.M.; Toomarian E.Y.; Norcia A.M.; McCandliss B.D.","Wang, Fang (57190426434); Nguyen, Quynh Trang H. (57223884489); Kaneshiro, Blair (56884405500); Hasak, Lindsey (57223896230); Wang, Angie M. (57412735600); Toomarian, Elizabeth Y. (56503973000); Norcia, Anthony M. (7006832042); McCandliss, Bruce D. (6602970048)","57190426434; 57223884489; 56884405500; 57223896230; 57412735600; 56503973000; 7006832042; 6602970048","Lexical and sublexical cortical tuning for print revealed by Steady-State Visual Evoked Potentials (SSVEPs) in early readers","2023","Developmental Science","26","4","e13352","","","","10.1111/desc.13352","https://www.scopus.com/inward/record.uri?eid=2-s2.0-85143582134&doi=10.1111%2fdesc.13352&partnerID=40&md5=c5f87b5c8e5a17151fc7b7977c9481c5","There are multiple levels of processing relevant to reading that vary in their visual, sublexical, and lexical orthographic processing demands. Segregating distinct cortical sources for each of these levels has been challenging in EEG studies of early readers. To address this challenge, we applied recent advances in analyzing high-density EEG using Steady-State Visual Evoked Potentials (SSVEPs) via data-driven Reliable Components Analysis (RCA) in a group of early readers spanning from kindergarten to second grade. Three controlled stimulus contrasts—familiar words versus unfamiliar pseudofonts, familiar words versus pseudowords, and pseudowords versus nonwords—were used to isolate coarse print tuning, lexical processing, and sublexical orthography-related processing, respectively. First, three overlapping yet distinct neural sources—left vOT, dorsal parietal, and primary visual cortex were revealed underlying coarse print tuning. Second, we segregated distinct cortical sources for the other two levels of processing: lexical fine tuning over occipito-temporal/parietal regions; sublexical orthographic fine tuning over left occipital regions. Finally, exploratory group analyses based on children's reading fluency suggested that coarse print tuning emerges early even in children with limited reading knowledge, while sublexical and higher-level lexical processing emerge only in children with sufficient reading knowledge. Research Highlights: Cognitive processes underlying coarse print tuning, sublexical, and lexical fine tuning were examined in beginning readers. Three overlapping yet distinct neural sources—left ventral occipito-temporal (vOT), left temporo-parietal, and primary visual cortex—were revealed underlying coarse print tuning. Responses to sublexical orthographic fine tuning were found over left occipital regions, while responses to higher-level linguistic fine tuning were found over occipito-temporal/parietal regions. Exploratory group analyses suggested that coarse print tuning emerges in children with limited reading knowledge, while sublexical and higher-level linguistic fine tuning effects emerge in children with sufficient reading knowledge. © 2022 The Authors. Developmental Science published by John Wiley & Sons Ltd.","Article","Scopus"
"Tyborowska A.; Volman I.; Niermann H.C.M.; Dapprich A.L.; Smeekens S.; Cillessen A.H.N.; Toni I.; Roelofs K.","Tyborowska, Anna (55841635900); Volman, Inge (26659316500); Niermann, Hannah C. M. (57193067726); Dapprich, Anna L. (57223956176); Smeekens, Sanny (16647081300); Cillessen, Antonius H. N. (6602876074); Toni, Ivan (6603768534); Roelofs, Karin (35585571200)","55841635900; 26659316500; 57193067726; 57223956176; 16647081300; 6602876074; 6603768534; 35585571200","Developmental shift in testosterone influence on prefrontal emotion control","2024","Developmental Science","27","1","e13415","","","","10.1111/desc.13415","https://www.scopus.com/inward/record.uri?eid=2-s2.0-85162730578&doi=10.1111%2fdesc.13415&partnerID=40&md5=4c836ffa1b997044878b792fe1252923","A paradox of testosterone effects is seen in adolescents versus adults in social emotional approach-avoidance behavior. During adolescence, high testosterone levels are associated with increased anterior prefrontal (aPFC) involvement in emotion control, whereas during adulthood this neuro-endocrine relation is reversed. Rodent work shows that, during puberty, testosterone transitions from a neuro-developmental to a social-sexual activating hormone. In this study, we explored whether this functional transition is also present in human adolescents and young adults. Using a prospective longitudinal design, we investigated the role of testosterone on neural control of social emotional behavior during the transitions from middle to late adolescence and into young adulthood. Seventy-one individuals (tested at ages 14, 17, and 20 years) performed an fMRI-adapted approach-avoidance (AA) task involving automatic and controlled actions in response to social emotional stimuli. In line with predictions from animal models, the effect of testosterone on aPFC engagement decreased between middle and late adolescence, and shifted into an activational role by young adulthood—impeding neural control of emotions. This change in testosterone function was accompanied by increased testosterone-modulated amygdala reactivity. These findings qualify the testosterone-dependent maturation of the prefrontal-amygdala circuit supporting emotion control during the transition from middle adolescence into young adulthood. © 2023 The Authors. Developmental Science published by John Wiley & Sons Ltd.","Article","Scopus"
