"Authors","Author full names","Author(s) ID","Title","Year","Source title","Volume","Issue","Art. No.","Page start","Page end","Page count","DOI","Link","Abstract","Document Type","Source"
"Wong A.; Cordes S.; Harris P.L.; Chernyak N.","Wong, Alyson (57256406600); Cordes, Sara (7005622755); Harris, Paul L. (7403636494); Chernyak, Nadia (35434364200)","57256406600; 7005622755; 7403636494; 35434364200","Being nice by choice: The effect of counterfactual reasoning on children's social evaluations","2023","Developmental Science","26","6","e13394","","","","10.1111/desc.13394","https://www.scopus.com/inward/record.uri?eid=2-s2.0-85153377260&doi=10.1111%2fdesc.13394&partnerID=40&md5=00b509f296654a6714bc18445cb7f4f1","The ability to engage in counterfactual thinking (reason about what else could have happened) is critical to learning, agency, and social evaluation. However, not much is known about how individual differences in counterfactual reasoning may play a role in children's social evaluations. In the current study, we investigate how prompting children to engage in counterfactual thinking about positive moral actions impacts children's social evaluations. Eighty-seven 4-8-year-olds were introduced to a character who engaged in a positive moral action (shared a sticker with a friend) and asked about what else the character could have done with the sticker (counterfactual simulation). Children were asked to generate either a high number of counterfactuals (five alternative actions) or a low number of counterfactuals (one alternative action). Children were then asked a series of social evaluation questions contrasting that character with one who did not have a choice and had no alternatives (was told to give away the sticker to his friend). Results show that children who generated selfish counterfactuals were more likely to positively evaluate the character with choice than children who did not generate selfish counterfactuals, suggesting that generating counterfactuals most distant from the chosen action (prosociality) leads children to view prosocial actions more positively. We also found age-related changes: as children got older, regardless of the type of counterfactuals generated, they were more likely to evaluate the character with choice more positively. These results highlight the importance of counterfactual reasoning in the development of moral evaluations. Research Highlights: Older children were more likely to endorse agents who choose to share over those who do not have a choice. Children who were prompted to generate more counterfactuals were more likely to allocate resources to characters with choice. Children who generated selfish counterfactuals more positively evaluated agents with choice. Comparable to theories suggesting children punish willful transgressors more than accidental transgressors, we propose children also consider free will when making positive moral evaluations. © 2023 The Authors. Developmental Science published by John Wiley & Sons Ltd.","Article","Scopus"
"Vanden Bosch der Nederlanden C.M.; Qi X.; Sequeira S.; Seth P.; Grahn J.A.; Joanisse M.F.; Hannon E.E.","Vanden Bosch der Nederlanden, Christina M. (59157897200); Qi, Xin (57991139800); Sequeira, Sarah (57991418700); Seth, Prakhar (57974562000); Grahn, Jessica A. (13407386100); Joanisse, Marc F. (6602547540); Hannon, Erin E. (8632364700)","59157897200; 57991139800; 57991418700; 57974562000; 13407386100; 6602547540; 8632364700","Developmental changes in the categorization of speech and song","2023","Developmental Science","26","5","e13346","","","","10.1111/desc.13346","https://www.scopus.com/inward/record.uri?eid=2-s2.0-85143237955&doi=10.1111%2fdesc.13346&partnerID=40&md5=df3bcf0bccb771322d9dee50ce6e6124","Music and language are two fundamental forms of human communication. Many studies examine the development of music- and language-specific knowledge, but few studies compare how listeners know they are listening to music or language. Although we readily differentiate these domains, how we distinguish music and language—and especially speech and song— is not obvious. In two studies, we asked how listeners categorize speech and song. Study 1 used online survey data to illustrate that 4- to 17-year-olds and adults have verbalizable distinctions for speech and song. At all ages, listeners described speech and song differences based on acoustic features, but compared with older children, 4- to 7-year-olds more often used volume to describe differences, suggesting that they are still learning to identify the features most useful for differentiating speech from song. Study 2 used a perceptual categorization task to demonstrate that 4–8-year-olds and adults readily categorize speech and song, but this ability improves with age especially for identifying song. Despite generally rating song as more speech-like, 4- and 6-year-olds rated ambiguous speech–song stimuli as more song-like than 8-year-olds and adults. Four acoustic features predicted song ratings: F0 instability, utterance duration, harmonicity, and spectral flux. However, 4- and 6-year-olds’ song ratings were better predicted by F0 instability than by harmonicity and utterance duration. These studies characterize how children develop conceptual and perceptual understandings of speech and song and suggest that children under age 8 are still learning what features are important for categorizing utterances as speech or song. Research Highlights: Children and adults conceptually and perceptually categorize speech and song from age 4. Listeners use F0 instability, harmonicity, spectral flux, and utterance duration to determine whether vocal stimuli sound like song. Acoustic cue weighting changes with age, becoming adult-like at age 8 for perceptual categorization and at age 12 for conceptual differentiation. Young children are still learning to categorize speech and song, which leaves open the possibility that music- and language-specific skills are not so domain-specific. © 2022 John Wiley & Sons Ltd.","Article","Scopus"
"Gijbels L.; Lee A.K.C.; Yeatman J.D.","Gijbels, Liesbeth (57219652510); Lee, Adrian K. C. (35484356000); Yeatman, Jason D. (35103808100)","57219652510; 35484356000; 35103808100","Children with developmental dyslexia have equivalent audiovisual speech perception performance but their perceptual weights differ","2024","Developmental Science","27","1","e13431","","","","10.1111/desc.13431","https://www.scopus.com/inward/record.uri?eid=2-s2.0-85164311590&doi=10.1111%2fdesc.13431&partnerID=40&md5=3b7d4aff17d90a1544b1079c2e0ad943","As reading is inherently a multisensory, audiovisual (AV) process where visual symbols (i.e., letters) are connected to speech sounds, the question has been raised whether individuals with reading difficulties, like children with developmental dyslexia (DD), have broader impairments in multisensory processing. This question has been posed before, yet it remains unanswered due to (a) the complexity and contentious etiology of DD along with (b) lack of consensus on developmentally appropriate AV processing tasks. We created an ecologically valid task for measuring multisensory AV processing by leveraging the natural phenomenon that speech perception improves when listeners are provided visual information from mouth movements (particularly when the auditory signal is degraded). We designed this AV processing task with low cognitive and linguistic demands such that children with and without DD would have equal unimodal (auditory and visual) performance. We then collected data in a group of 135 children (age 6.5–15) with an AV speech perception task to answer the following questions: (1) How do AV speech perception benefits manifest in children, with and without DD? (2) Do children all use the same perceptual weights to create AV speech perception benefits, and (3) what is the role of phonological processing in AV speech perception? We show that children with and without DD have equal AV speech perception benefits on this task, but that children with DD rely less on auditory processing in more difficult listening situations to create these benefits and weigh both incoming information streams differently. Lastly, any reported differences in speech perception in children with DD might be better explained by differences in phonological processing than differences in reading skills. Research Highlights: Children with versus without developmental dyslexia have equal audiovisual speech perception benefits, regardless of their phonological awareness or reading skills. Children with developmental dyslexia rely less on auditory performance to create audiovisual speech perception benefits. Individual differences in speech perception in children might be better explained by differences in phonological processing than differences in reading skills. © 2023 John Wiley & Sons Ltd.","Article","Scopus"
"Viktorsson C.; Lindskog M.; Li D.; Tammimies K.; Taylor M.J.; Ronald A.; Falck-Ytter T.","Viktorsson, Charlotte (57194942427); Lindskog, Marcus (54389567100); Li, Danyang (57189350986); Tammimies, Kristiina (24492334900); Taylor, Mark J. (8731398500); Ronald, Angelica (56046160900); Falck-Ytter, Terje (14026541100)","57194942427; 54389567100; 57189350986; 24492334900; 8731398500; 56046160900; 14026541100","Infants’ sense of approximate numerosity: Heritability and link to other concurrent traits","2023","Developmental Science","26","4","e13347","","","","10.1111/desc.13347","https://www.scopus.com/inward/record.uri?eid=2-s2.0-85142895247&doi=10.1111%2fdesc.13347&partnerID=40&md5=4dec6f6efddeb226a7040099f7ef4508","The ability to perceive approximate numerosity is present in many animal species, and emerges early in human infants. Later in life, it is moderately heritable and associated with mathematical abilities, but the etiology of the Approximate Number System (ANS) and its degree of independence from other cognitive abilities in infancy is unknown. Here, we assessed the phenotypic specificity as well as the influence of genetic and environmental factors on the ANS in a sample of 5-month-old twins (N = 514). We found a small-to-moderate but statistically significant effect of genetic factors on ANS acuity (heritability = 0.18, 95% CI: 0.02, 0.33), but only when differences in numerosity were relatively large (1:4 ratio). Non-verbal ability assessed with the Mullen Scales of Early Learning (MSEL) was found to be heritable (0.47; 95% CI: 0.34, 0.57) and the phenotypic association between ANS acuity and non-verbal ability performance was close to zero. Similarly, we found no association between ANS acuity and general attention during the task. An unexpected weak but statistically significant negative association between ANS acuity and scores on the receptive language scale of the MSEL was found. These results suggest that early ANS function may be largely independent from other aspects of non-verbal development. Further, variability in ANS in infancy seems to, to some extent, reflect genotypic differences in the population. Highlights: Assessing 514 infant twins with eye tracking, we found that infants' sense of approximate numerosity is heritable and not positively associated with concurrent attentional, cognitive or motor abilities. These results have implications for our understanding of development of mathematical ability and the link between cognitive abilities early in postnatal life. © 2022 The Authors. Developmental Science published by John Wiley & Sons Ltd.","Article","Scopus"
"Mendez A.H.; Yu C.; Smith L.B.","Mendez, Andres H. (58561729800); Yu, Chen (16032623800); Smith, Linda B. (7410395494)","58561729800; 16032623800; 7410395494","Controlling the input: How one-year-old infants sustain visual attention","2024","Developmental Science","27","2","e13445","","","","10.1111/desc.13445","https://www.scopus.com/inward/record.uri?eid=2-s2.0-85169705902&doi=10.1111%2fdesc.13445&partnerID=40&md5=7c12fde1ca81fdd9df0376c1d40c22a1","Traditionally, the exogenous control of gaze by external saliencies and the endogenous control of gaze by knowledge and context have been viewed as competing systems, with late infancy seen as a period of strengthening top-down control over the vagaries of the input. Here we found that one-year-old infants control sustained attention through head movements that increase the visibility of the attended object. Freely moving one-year-old infants (n = 45) wore head-mounted eye trackers and head motion sensors while exploring sets of toys of the same physical size. The visual size of the objects, a well-documented salience, varied naturally with the infant's moment-to-moment posture and head movements. Sustained attention to an object was characterized by the tight control of head movements that created and then stabilized a visual size advantage for the attended object for sustained attention. The findings show collaboration between exogenous and endogenous attentional systems and suggest new hypotheses about the development of sustained visual attention. © 2023 The Authors. Developmental Science published by John Wiley & Sons Ltd.","Article","Scopus"
"Benton D.T.; Kamper D.; Beaton R.M.; Sobel D.M.","Benton, Deon T. (57204598087); Kamper, David (57928990700); Beaton, Rebecca M. (58748993200); Sobel, David M. (7004480764)","57204598087; 57928990700; 58748993200; 7004480764","Don't throw the associative baby out with the Bayesian bathwater: Children are more associative when reasoning retrospectively under information processing demands","2024","Developmental Science","27","3","e13464","","","","10.1111/desc.13464","https://www.scopus.com/inward/record.uri?eid=2-s2.0-85178924509&doi=10.1111%2fdesc.13464&partnerID=40&md5=6733551ecfac234e17899e19a7e414e1","Causal reasoning is a fundamental cognitive ability that enables individuals to learn about the complex interactions in the world around them. However, the mechanisms that underpin causal reasoning are not well understood. For example, it remains unresolved whether children's causal inferences are best explained by Bayesian inference or associative learning. The two experiments and computational models reported here were designed to examine whether 5- and 6-year-olds will retrospectively reevaluate objects—that is, adjust their beliefs about the causal status of some objects presented at an earlier point in time based on the observed causal status of other objects presented at a later point in time—when asked to reason about 3 and 4 objects and under varying degrees of information processing demands. Additionally, the experiments and models were designed to determine whether children's retrospective reevaluations were best explained by associative learning, Bayesian inference, or some combination of both. The results indicated that participants retrospectively reevaluated causal inferences under minimal information-processing demands (Experiment 1) but failed to do so under greater information processing demands (Experiment 2) and that their performance was better captured by an associative learning mechanism, with less support for descriptions that rely on Bayesian inference. Research Highlights: Five- and 6-year-old children engage in retrospective reevaluation under minimal information-processing demands (Experiment 1). Five- and 6-year-old children do not engage in retrospective reevaluation under more extensive information-processing demands (Experiment 2). Across both experiments, children's retrospective reevaluations were better explained by a simple associative learning model, with only minimal support for a simple Bayesian model. These data contribute to our understanding of the cognitive mechanisms by which children make causal judgements. © 2023 John Wiley & Sons Ltd.","Article","Scopus"
"Guerra G.; Tierney A.; Tijms J.; Vaessen A.; Bonte M.; Dick F.","Guerra, Giada (57202818556); Tierney, Adam (15053610400); Tijms, Jurgen (6507134081); Vaessen, Anniek (26041125300); Bonte, Milene (6602672591); Dick, Frederic (14522185400)","57202818556; 15053610400; 6507134081; 26041125300; 6602672591; 14522185400","Attentional modulation of neural sound tracking in children with and without dyslexia","2024","Developmental Science","27","1","e13420","","","","10.1111/desc.13420","https://www.scopus.com/inward/record.uri?eid=2-s2.0-85162727644&doi=10.1111%2fdesc.13420&partnerID=40&md5=4b7f5342a58c53fccae60da136b5f76e","Auditory selective attention forms an important foundation of children's learning by enabling the prioritisation and encoding of relevant stimuli. It may also influence reading development, which relies on metalinguistic skills including the awareness of the sound structure of spoken language. Reports of attentional impairments and speech perception difficulties in noisy environments in dyslexic readers are also suggestive of the putative contribution of auditory attention to reading development. To date, it is unclear whether non-speech selective attention and its underlying neural mechanisms are impaired in children with dyslexia and to which extent these deficits relate to individual reading and speech perception abilities in suboptimal listening conditions. In this EEG study, we assessed non-speech sustained auditory selective attention in 106 7-to-12-year-old children with and without dyslexia. Children attended to one of two tone streams, detecting occasional sequence repeats in the attended stream, and performed a speech-in-speech perception task. Results show that when children directed their attention to one stream, inter-trial-phase-coherence at the attended rate increased in fronto-central sites; this, in turn, was associated with better target detection. Behavioural and neural indices of attention did not systematically differ as a function of dyslexia diagnosis. However, behavioural indices of attention did explain individual differences in reading fluency and speech-in-speech perception abilities: both these skills were impaired in dyslexic readers. Taken together, our results show that children with dyslexia do not show group-level auditory attention deficits but these deficits may represent a risk for developing reading impairments and problems with speech perception in complex acoustic environments. Research Highlights: Non-speech sustained auditory selective attention modulates EEG phase coherence in children with/without dyslexia Children with dyslexia show difficulties in speech-in-speech perception Attention relates to dyslexic readers’ speech-in-speech perception and reading skills Dyslexia diagnosis is not linked to behavioural/EEG indices of auditory attention. © 2023 The Authors. Developmental Science published by John Wiley & Sons Ltd.","Article","Scopus"
"Alonso K.W.; Dahhan N.Z.A.; Riggs L.; Tseng J.; de Medeiros C.; Scott M.; Laughlin S.; Bouffet E.; Mabbott D.J.","Alonso, Katie Wade (58283349000); Dahhan, Noor Z. Al (58283836500); Riggs, Lily (24336398900); Tseng, Julie (57218117156); de Medeiros, Cynthia (57194340603); Scott, Ming (58283836600); Laughlin, Suzanne (13906578500); Bouffet, Eric (57203082668); Mabbott, Donald J. (6508219856)","58283349000; 58283836500; 24336398900; 57218117156; 57194340603; 58283836600; 13906578500; 57203082668; 6508219856","Network connectivity underlying episodic memory in children: Application of a pediatric brain tumor survivor injury model","2024","Developmental Science","27","1","e13413","","","","10.1111/desc.13413","https://www.scopus.com/inward/record.uri?eid=2-s2.0-85159904700&doi=10.1111%2fdesc.13413&partnerID=40&md5=125476fc159d481be351ae504f4c12cc","Episodic memory involves personal experiences paired with their context. The Medial Temporal, Posterior Medial, Anterior Temporal, and Medial Prefrontal networks have been found to support the hippocampus in episodic memory in adults. However, there lacks a model that captures how the structural and functional connections of these networks interact to support episodic memory processing in children. Using diffusion-weighted imaging, magnetoencephalography, and memory tests, we quantified differences in white matter microstructure, neural communication, and episodic memory performance, respectively, of healthy children (n = 23) and children with reduced memory performance. Pediatric brain tumor survivors (PBTS; n = 24) were used as a model, as they exhibit reduced episodic memory and perturbations in white matter and neural communication. We observed that PBTS, compared to healthy controls, showed significantly (p < 0.05) (1) disrupted white matter microstructure between these episodic memory networks through lower fractional anisotropy and higher mean and axial diffusivity, (2) perturbed theta band (4–7 Hz) oscillatory synchronization in these same networks through higher weighted phase lag indices (wPLI), and (3) lower episodic memory performance in the Transverse Patterning and Children's Memory Scale (CMS) tasks. Using partial-least squares path modeling, we found that brain tumor treatment predicted network white matter damage, which predicted inter-network theta hypersynchrony and lower verbal learning (directly) and lower verbal recall (indirectly via theta hypersynchrony). Novel to the literature, our findings suggest that white matter modulates episodic memory through effect on oscillatory synchronization within relevant brain networks. Research Highlights: Investigates the relationship between structural and functional connectivity of episodic memory networks in healthy children and pediatric brain tumor survivors Pediatric brain tumor survivors demonstrate disrupted episodic memory, white matter microstructure and theta oscillatory synchronization compared to healthy children Findings suggest white matter microstructure modulates episodic memory through effects on oscillatory synchronization within relevant episodic memory networks. © 2023 The Authors. Developmental Science published by John Wiley & Sons Ltd.","Article","Scopus"
"Bakopoulou M.; Lorenz M.G.; Forbes S.H.; Tremlin R.; Bates J.; Samuelson L.K.","Bakopoulou, Milena (58194404700); Lorenz, Megan G. (57194521731); Forbes, Samuel H. (57204198290); Tremlin, Rachel (6506149037); Bates, Jessica (58193849100); Samuelson, Larissa K. (7201985574)","58194404700; 57194521731; 57204198290; 6506149037; 58193849100; 7201985574","Vocabulary and automatic attention: The relation between novel words and gaze dynamics in noun generalization","2023","Developmental Science","26","6","e13399","","","","10.1111/desc.13399","https://www.scopus.com/inward/record.uri?eid=2-s2.0-85153376686&doi=10.1111%2fdesc.13399&partnerID=40&md5=07089db8677a3ec7291beb5ab8449e46","Words direct visual attention in infants, children, and adults, presumably by activating representations of referents that then direct attention to matching stimuli in the visual scene. Novel, unknown, words have also been shown to direct attention, likely via the activation of more general representations of naming events. To examine the critical issue of how novel words and visual attention interact to support word learning we coded frame-by-frame the gaze of 17- to 31-month-old children (n = 66, 38 females) while generalizing novel nouns. We replicate prior findings of more attention to shape when generalizing novel nouns, and a relation to vocabulary development. However, we also find that following a naming event, children who produce fewer nouns take longer to look at the objects they eventually select and make more transitions between objects before making a generalization decision. Children who produce more nouns look to the objects they eventually select more quickly following the naming event and make fewer looking transitions. We discuss these findings in the context of prior proposals regarding children's few-shot category learning, and a developmental cascade of multiple perceptual, cognitive, and word-learning processes that may operate in cases of both typical development and language delay. Research Highlights: Examined how novel words guide visual attention by coding frame-by-frame where children look when asked to generalize novel names. Gaze patterns differed with vocabulary size: children with smaller vocabularies attended to generalization targets more slowly and did more comparison than those with larger vocabularies. Demonstrates a relationship between vocabulary size and attention to object properties during naming. This work has implications for looking-based tests of early cognition, and our understanding of children's few-shot category learning. © 2023 The Authors. Developmental Science published by John Wiley & Sons Ltd.","Article","Scopus"
