"Authors","Author full names","Author(s) ID","Title","Year","Source title","Volume","Issue","Art. No.","Page start","Page end","Page count","DOI","Link","Abstract","Document Type","Source"
"Choi Y.; Nam M.; Yamane N.; Mazuka R.","Choi, Youngon (7404777397); Nam, Minji (58315579700); Yamane, Naoto (54584598200); Mazuka, Reiko (6602448465)","7404777397; 58315579700; 54584598200; 6602448465","Lack of early sensitivity and gradual emergence of native phoneme categories: A pattern from underrepresented language learners","2024","Developmental Science","27","5","e13422","","","","10.1111/desc.13422","https://www.scopus.com/inward/record.uri?eid=2-s2.0-85161977280&doi=10.1111%2fdesc.13422&partnerID=40&md5=c447e3f4896938b68131cc945dad293a","Perceptual narrowing of speech perception supposes that young infants can discriminate most speech sounds early in life. During the second half of the first year, infants’ phonetic sensitivity is attuned to their native phonology. However, supporting evidence for this pattern comes primarily from learners from a limited number of regions and languages. Very little evidence has accumulated on infants learning languages spoken in Asia, which accounts for most of the world's population. The present study examined the developmental trajectory of Korean-learning infants’ sensitivity to a native stop contrast during the first year of life. The Korean language utilizes unusual voiceless three-way stop categories, requiring target categories to be derived from tight phonetic space. Further, two of these categories—lenis and aspirated—have undergone a diachronic change in recent decades as the primary acoustic cue for distinction has shifted among modern speakers. Consequently, the input distributions of these categories are mixed across speakers and speech styles, requiring learners to build flexible representations of target categories along these variations. The results showed that among the three age groups—4–6 months, 7–9 months, and 10–12 months—we tested, only 10–12-month-olds showed weak sensitivity to the two categories, suggesting that robust discrimination is not in place by the end of the first year. The study adds scarcely represented data, lending additional support for the lack of early sensitivity and prolonged emergence of native phonology that are inconsistent with learners of predominant studies and calls for more diverse samples to verify the generality of the typical perceptual narrowing pattern. Research Highlights: We investigated Korean-learning infants’ developmental trajectory of native phoneme categories and whether they show the typical perceptual narrowing pattern. Robust discrimination did not appear until 12 months, suggesting that Korean infants’ native phonology is not stabilized by the end of the first year. The prolonged emergence of sensitivity could be due to restricted phonetic space and input variations but suggests the possibility of a different developmental trajectory. The current study contributes scarcely represented Korean-learning infants’ phonetic discrimination data to the speech development field. © 2023 John Wiley & Sons Ltd.","Article","Scopus"
"Ren H.; Hart C.H.; Cheah C.S.L.; Porter C.L.; Nelson D.A.; Yavuz-Müren H.M.; Gao W.; Haron F.; Jiang L.; Kawashima A.; Shibazaki-Lau A.; Nakazawa J.; Nelson L.J.; Robinson C.C.; Selçuk A.B.; Evans-Stout C.; Tan J.-P.; Yang C.; Quek A.-H.; Zhou N.","Ren, Huiguang (57205260540); Hart, Craig H. (7402569014); Cheah, Charissa S. L. (7007112847); Porter, Chris L. (7202933913); Nelson, David A. (56322101100); Yavuz-Müren, H. Melis (58097763600); Gao, Wen (57555670200); Haron, Fatimah (35198018200); Jiang, Liuqing (58108035300); Kawashima, Akiko (56402673000); Shibazaki-Lau, Ai (58155547600); Nakazawa, Jun (36842954800); Nelson, Larry J. (7402251333); Robinson, Clyde C. (7403375153); Selçuk, Ayşe Bilge (58097779400); Evans-Stout, Cortney (57204961743); Tan, Jo-Pei (26032370900); Yang, Chongming (8429843300); Quek, Ai-Hwa (59430112900); Zhou, Nan (57201995487)","57205260540; 7402569014; 7007112847; 7202933913; 56322101100; 58097763600; 57555670200; 35198018200; 58108035300; 56402673000; 58155547600; 36842954800; 7402251333; 7403375153; 58097779400; 57204961743; 26032370900; 8429843300; 59430112900; 57201995487","Parenting measurement, normativeness, and associations with child outcomes: Comparing evidence from four non-Western cultures","2024","Developmental Science","27","5","e13388","","","","10.1111/desc.13388","https://www.scopus.com/inward/record.uri?eid=2-s2.0-85150808181&doi=10.1111%2fdesc.13388&partnerID=40&md5=c57967a806db68f2ea6db806eb941f9b","This study compared parenting across four non-Western cultures to test cross-cultural commonality and specificity principles in three aspects: measurement properties, parenting normativeness, and their associations with child outcomes. Both mothers and fathers (N = 1509 dyads) with preschool-aged children (M = 5.00 years; 48% girls) from urban areas of four countries (Malaysia, N = 372; China, N = 441; Turkey, N = 402; and Japan, N = 294) reported on four parenting constructs (authoritative, authoritarian, group harmony socialization, and intrusive control) and their sub-dimensions using modified culturally relevant measures. Teachers reported on children's internalizing, externalizing, and prosocial behaviors. The commonality principle was supported by two sets of findings: (1) full measurement invariance was established for most parenting constructs and sub-dimensions, except that intrusive control only reached partial scalar invariance, and (2) no variations were found in associations between parenting and any child outcomes across cultures or parent gender at the construct level for all four parenting constructs and at the sub-dimensional level for authoritarian and intrusive control sub-dimensions. The specificity principle was supported by the other two sets of findings: (1) cross-cultural differences in parenting normativeness did not follow the pattern of economic development but yielded culture-specific patterns, and (2) at the sub-dimensional level, the authoritative parenting and group harmony socialization sub-dimensions were differently associated with child outcomes across cultures and/or parent gender. The findings suggested that examining specific dimensions rather than broad parenting constructs is necessary to reflect cultural specificities and nuances. Our study provided a culturally-invariant instrument and a three-step guide for future parenting research to examine cross-cultural commonalities/specificities. Research Highlights: This is the first study to use an instrument with measurement invariance across multiple non-Western cultures to examine the commonality and specificity principles in parenting. Measurement invariance was achieved across cultures for authoritative and authoritarian parenting, group harmony socialization, intrusive control, and their sub-dimensions, supporting the commonality principle. Cross-cultural differences in parenting normativeness did not follow the pattern of economic development but yielded culture-specific patterns, supporting the specificity principle. Both commonalities and specificities were manifested in associations between parenting and child outcomes across cultures. © 2023 John Wiley & Sons Ltd.","Article","Scopus"
"Hassan R.; Schmidt L.A.","Hassan, Raha (57201338044); Schmidt, Louis A. (57220789031)","57201338044; 57220789031","A dyadic investigation of shy children's behavioral and affective responses to delivering a speech","2024","Developmental Science","27","6","e13558","","","","10.1111/desc.13558","https://www.scopus.com/inward/record.uri?eid=2-s2.0-85201562636&doi=10.1111%2fdesc.13558&partnerID=40&md5=c223cf96c85111a87ea9e822952e7afc","Shyness is typically associated with avoidant social behavior and restricted affect in new social situations. However, we know considerably less about how one child's shyness influences another child's behavior and affect in new social situations. Children's shyness was parent-reported when children were age 3 (N = 105, 52 girls, Mage= 3.50 years), and children were tested approximately 1 year later (Mage= 4.76 years) in same-gender dyads where they were asked to give an impromptu speech about their most recent birthday in front of an experimenter and the other member of the dyad. We examined whether children's shyness and speech order influenced their own and their social partner's observed behavior and affect during the speech. Regardless of speech order, children's own shyness was positively associated with their own avoidant social behavior and gaze aversion. Regardless of shyness, children who gave their speech second averted their gaze more than children who gave their speech first. We also found that children who gave their speech second displayed less positive affect if their social partner who they watched give the speech first was shyer. We speculate that some 4-year-old children may be sensitive to the avoidant behaviors of their shy peers and, in turn, respond with less animation when it is their turn to participate in the same activity. Research Highlights: We examined whether preschool children's shyness and speech order influenced their own and their social partner's observed behavior and affect during a dyadic speech task Children's own shyness was positively associated with their own avoidant social behavior and gaze aversion Children who gave their speech second averted their gaze more than children who gave their speech first. Children who gave their speech second displayed less positive affect if their social partner who they watched give a speech first was shyer These findings suggest that preschool-aged children are sensitive to learning about their environment indirectly through social observation. © 2024 John Wiley & Sons Ltd.","Article","Scopus"
"Hippe L.; Hennessy V.; Ramirez N.F.; Zhao T.C.","Hippe, Lindsay (58480371600); Hennessy, Victoria (59133367400); Ramirez, Naja Ferjan (56627026600); Zhao, T. Christina (56562267400)","58480371600; 59133367400; 56627026600; 56562267400","Comparison of speech and music input in North American infants’ home environment over the first 2 years of life","2024","Developmental Science","27","5","e13528","","","","10.1111/desc.13528","https://www.scopus.com/inward/record.uri?eid=2-s2.0-85193515358&doi=10.1111%2fdesc.13528&partnerID=40&md5=5e23af0807dc85e2f6a08d3011a567ee","Infants are immersed in a world of sounds from the moment their auditory system becomes functional, and experience with the auditory world shapes how their brain processes sounds in their environment. Across cultures, speech and music are two dominant auditory signals in infants’ daily lives. Decades of research have repeatedly shown that both quantity and quality of speech input play critical roles in infant language development. Less is known about the music input infants receive in their environment. This study is the first to compare music input to speech input across infancy by analyzing a longitudinal dataset of daylong audio recordings collected in English-learning infants’ home environments, at 6, 10, 14, 18, and 24 months of age. Using a crowdsourcing approach, 643 naïve listeners annotated 12,000 short snippets (10 s) randomly sampled from the recordings using Zooniverse, an online citizen-science platform. Results show that infants overall receive significantly more speech input than music input and the gap widens as the infants get older. At every age point, infants were exposed to more music from an electronic device than an in-person source; this pattern was reversed for speech. The percentage of input intended for infants remained the same over time for music while that percentage significantly increased for speech. We propose possible explanations for the limited music input compared to speech input observed in the present (North American) dataset and discuss future directions. We also discuss the opportunities and caveats in using a crowdsourcing approach to analyze large audio datasets. A video abstract of this article can be viewed at https://youtu.be/lFj_sEaBMN4. Research Highlights: This study is the first to compare music input to speech input in infants’ natural home environment across infancy. We utilized a crowdsourcing approach to annotate a longitudinal dataset of daylong audio recordings collected in North American home environments. Our main results show that infants overall receive significantly more speech input than music input. This gap widens as the infants get older. Our results also showed that the music input was largely from electronic devices and not intended for the infants, a pattern opposite to speech input. © 2024 John Wiley & Sons Ltd.","Article","Scopus"
"Park Y.; Zhang Y.; Chang H.; Menon V.","Park, Yunji (57054384400); Zhang, Yuan (57190987256); Chang, Hyesang (56815991100); Menon, Vinod (57203179800)","57054384400; 57190987256; 56815991100; 57203179800","Short-term number sense training recapitulates long-term neurodevelopmental changes from childhood to adolescence","2024","Developmental Science","27","5","e13524","","","","10.1111/desc.13524","https://www.scopus.com/inward/record.uri?eid=2-s2.0-85192141649&doi=10.1111%2fdesc.13524&partnerID=40&md5=4d4699e6da0e74b624b56b218804fba0","Number sense is fundamental to the development of numerical problem-solving skills. In early childhood, children establish associations between non-symbolic (e.g., a set of dots) and symbolic (e.g., Arabic numerals) representations of quantity. The developmental estrangement theory proposes that the relationship between non-symbolic and symbolic representations of quantity evolves with age, with increased dissociation across development. Consistent with this theory, recent research suggests that cross-format neural representational similarity (NRS) between non-symbolic and symbolic quantities is correlated with arithmetic fluency in children but not in adolescents. However, it is not known if short-term training (STT) can induce similar changes as long-term development. In this study, children aged 7–10 years underwent a theoretically motivated 4-week number sense training. Using multivariate neural pattern analysis, we investigated whether short-term learning could modify the relation between cross-format NRS and arithmetic skills. Our results revealed a significant correlation between cross-format NRS and arithmetic fluency in distributed brain regions, including the parietal and prefrontal cortices, prior to training. However, this association was no longer observed after training, and multivariate predictive models confirmed these findings. Our findings provide evidence that intensive STT during early childhood can promote behavioral improvements and neural plasticity that resemble and recapitulate long-term neurodevelopmental changes that occur from childhood to adolescence. More generally, our study contributes to our understanding of the malleability of number sense and highlights the potential for targeted interventions to shape neurodevelopmental trajectories in early childhood. Research Highlights: We tested the hypothesis that short-term number sense training induces the dissociation of symbolic numbers from non-symbolic representations of quantity in children. We leveraged a theoretically motivated intervention and multivariate pattern analysis to determine training-induced neurocognitive changes in the relation between number sense and arithmetic problem-solving skills. Neural representational similarity between non-symbolic and symbolic quantity representations was correlated with arithmetic skills before training but not after training. Short-term training recapitulates long-term neurodevelopmental changes associated with numerical problem-solving from childhood to adolescence. © 2024 John Wiley & Sons Ltd.","Article","Scopus"
"Gross E.B.; Fine R.D.; Gülgöz S.; Olson K.R.; Gelman S.A.","Gross, E.B. (59436250100); Fine, Rachel D. (57205614906); Gülgöz, Selin (56281661100); Olson, Kristina R. (15058037500); Gelman, Susan A. (7102254014)","59436250100; 57205614906; 56281661100; 15058037500; 7102254014","Children's gender essentialism and prejudice: Testing causal links via an experimental manipulation","2024","Developmental Science","27","5","e13532","","","","10.1111/desc.13532","https://www.scopus.com/inward/record.uri?eid=2-s2.0-85195423851&doi=10.1111%2fdesc.13532&partnerID=40&md5=a1de26c16f6a0b678eed31de622528bd","Despite increases in visibility, gender-nonconforming young people continue to be at risk for bullying and discrimination. Prior work has established that gender essentialism in children correlates with prejudice against people who do not conform to gender norms, but to date no causal link has been established. The present study investigated this link more directly by testing whether children's gender essentialism and prejudice against gender nonconformity can be reduced by exposure to anti-essentialist messaging. Children ages 6–10 years of age (N = 102) in the experimental condition viewed a short video describing similarities between boys and girls and variation within each gender; children in the control condition (N = 102) viewed a corresponding video describing similarities between two types of climate and variation within each. Children then received measures of gender essentialism and prejudice against gender nonconformity. Finally, to ask whether manipulating children's gender essentialism extends to another domain, we included assessments of racial essentialism and prejudice. We found positive correlations between gender essentialism and prejudice against gender nonconformity; both also correlated negatively with participant age. However, we observed no differences between children in the experimental versus control conditions in overall essentialism or prejudice, indicating that our video was largely ineffective in manipulating essentialism. Accordingly, we were unable to provide evidence of a causal relationship between essentialism and prejudice. We did, however, see a difference between conditions on the discreteness measure, which is most closely linked to the wording in the video. This finding suggests that specific aspects of essentialism in young children may be modifiable. Research Highlights: Consistent with prior research, we found that greater gender essentialism was associated with greater prejudice against gender-nonconforming children; both decreased with age. We randomly assigned children to view either an anti-essentialist video manipulation or a control video to test if this relation was causal in nature. The anti-essentialist video did not reduce overall essentialism as compared to the control, so we did not find support for a causal link. We observed a reduction in the dimension of essentialism most closely linked to the anti-essentialist video language, suggesting the potential utility of anti-essentialist messaging. © 2024 The Author(s). Developmental Science published by John Wiley & Sons Ltd.","Article","Scopus"
"Vermeent S.; Young E.S.; DeJoseph M.L.; Schubert A.-L.; Frankenhuis W.E.","Vermeent, Stefan (57191903207); Young, Ethan S. (56875131600); DeJoseph, Meriah L. (57193215141); Schubert, Anna-Lena (56333115400); Frankenhuis, Willem E. (23004389400)","57191903207; 56875131600; 57193215141; 56333115400; 23004389400","Cognitive deficits and enhancements in youth from adverse conditions: An integrative assessment using Drift Diffusion Modeling in the ABCD study","2024","Developmental Science","27","4","e13478","","","","10.1111/desc.13478","https://www.scopus.com/inward/record.uri?eid=2-s2.0-85184250683&doi=10.1111%2fdesc.13478&partnerID=40&md5=1ce7f6d94fcdd1aac4a56b27f8faa92c","Childhood adversity can lead to cognitive deficits or enhancements, depending on many factors. Though progress has been made, two challenges prevent us from integrating and better understanding these patterns. First, studies commonly use and interpret raw performance differences, such as response times, which conflate different stages of cognitive processing. Second, most studies either isolate or aggregate abilities, obscuring the degree to which individual differences reflect task-general (shared) or task-specific (unique) processes. We addressed these challenges using Drift Diffusion Modeling (DDM) and structural equation modeling (SEM). Leveraging a large, representative sample of 9–10 year-olds from the Adolescent Brain Cognitive Development (ABCD) study, we examined how two forms of adversity—material deprivation and household threat—were associated with performance on tasks measuring processing speed, inhibition, attention shifting, and mental rotation. Using DDM, we decomposed performance on each task into three distinct stages of processing: speed of information uptake, response caution, and stimulus encoding/response execution. Using SEM, we isolated task-general and task-specific variances in each processing stage and estimated their associations with the two forms of adversity. Youth with more exposure to household threat (but not material deprivation) showed slower task-general processing speed, but showed intact task-specific abilities. In addition, youth with more exposure to household threat tended to respond more cautiously in general. These findings suggest that traditional assessments might overestimate the extent to which childhood adversity reduces specific abilities. By combining DDM and SEM approaches, we can develop a more nuanced understanding of how adversity affects different aspects of youth's cognitive performance. Research Highlight: To understand how childhood adversity shapes cognitive abilities, the field needs analytical approaches that can jointly document and explain patterns of lowered and enhanced performance. Using Drift Diffusion Modeling and Structural Equation Modeling, we analyzed associations between adversity and processing speed, inhibition, attention shifting, and mental rotation. Household threat, but not material deprivation, was mostly associated with slower task-general processing speed and more response caution. In contrast, task-specific abilities were largely intact. Researchers might overestimate the impact of childhood adversity on specific abilities and underestimate the impact on general processing speed and response caution using traditional measures. © 2024 The Authors. Developmental Science published by John Wiley & Sons Ltd.","Article","Scopus"
"Unger L.; Chang T.; Savic O.; Bergen B.K.; Sloutsky V.M.","Unger, Layla (23471223100); Chang, Tyler (57223724186); Savic, Olivera (57199645690); Bergen, Benjamin K. (8954474400); Sloutsky, Vladimir M. (6701387276)","23471223100; 57223724186; 57199645690; 8954474400; 6701387276","When is a word in good company for learning?","2024","Developmental Science","27","5","e13510","","","","10.1111/desc.13510","https://www.scopus.com/inward/record.uri?eid=2-s2.0-85190447863&doi=10.1111%2fdesc.13510&partnerID=40&md5=270bde5d5b8356fbe1b722c0e08d405d","Although identifying the referents of single words is often cited as a key challenge for getting word learning off the ground, it overlooks the fact that young learners consistently encounter words in the context of other words. How does this company help or hinder word learning? Prior investigations into early word learning from children's real-world language input have yielded conflicting results, with some influential findings suggesting an advantage for words that keep a diverse company of other words, and others suggesting the opposite. Here, we sought to triangulate the source of this conflict, comparing different measures of diversity and approaches to controlling for correlated effects of word frequency across multiple languages. The results were striking: while different diversity measures on their own yielded conflicting results, once nonlinear relationships with word frequency were controlled, we found convergent evidence that contextual consistency supports early word learning. Research Highlights: The words children learn occur in a sea of other words. The company words keep ranges from highly variable to highly consistent and circumscribed. Prior findings conflict over whether variability versus consistency helps early word learning. Accounting for correlated effects of word frequency resolved the conflict across multiple languages. Results reveal convergent evidence that consistency helps early word learning. © 2024 The Authors. Developmental Science published by John Wiley & Sons Ltd.","Article","Scopus"
